{
  "version": 1,
  "id": "greybox",
  "start": "greybox/greybox-room",
  "links": [
    { "a": "greybox/greybox-room#door-s", "b": "greybox/rest-room#door-n" },
    { "a": "greybox/rest-room#door-e", "b": "greybox/brain-corridor#door-w" },
    { "a": "greybox/brain-corridor#door-e", "b": "greybox/caffeine-arena#door-w" },
    { "a": "greybox/greybox-room#door-n", "b": "greybox/lock-hall#door-s" },
    { "a": "greybox/lock-hall#door-w", "b": "greybox/archive#door-e" },
    { "a": "greybox/lock-hall#door-n", "b": "greybox/archive#door-s" },
    { "a": "greybox/archive#door-w", "b": "greybox/storeroom#door-e" },
    { "a": "greybox/storeroom#door-w", "b": "greybox/loading-dock#door-e" },
    { "a": "greybox/loading-dock#door-w", "b": "greybox/lock-hall#door-e" }
  ]
}
